<?xml version="1.0" encoding="UTF-8"?>

<!--

-->

<vulnerabilities xmlns:xsi="http://www.w3.org/2001/XMLSchema-instance"
                 xsi:noNamespaceSchemaLocation="vuln.xsd">

  <theme name="onepagewebsite">
    <vulnerability>
      <title>onepagewebsite Full Path Disclosure vulnerability</title>
      <reference>http://1337day.com/exploit/20027</reference>
      <type>FPD</type>
    </vulnerability>
  </theme>

  <theme name="vithy">
    <vulnerability>
      <title>vithy Full Path Disclosure vulnerability</title>
      <reference>http://1337day.com/exploit/20040</reference>
      <type>FPD</type>
    </vulnerability>
  </theme>

  <theme name="appius">
    <vulnerability>
      <title>appius Full Path Disclosure vulnerability</title>
      <reference>http://1337day.com/exploit/20039</reference>
      <type>FPD</type>
    </vulnerability>
  </theme>

  <theme name="yvora">
    <vulnerability>
      <title>yvora Full Path Disclosure vulnerability</title>
      <reference>http://1337day.com/exploit/20038</reference>
      <type>FPD</type>
    </vulnerability>
  </theme>

  <theme name="shotzz">
    <vulnerability>
      <title>shotzz Full Path Disclosure vulnerability</title>
      <reference>http://1337day.com/exploit/20041</reference>
      <type>FPD</type>
    </vulnerability>
  </theme>

  <theme name="moneymasters">
    <vulnerability>
      <title>moneymasters Full Path Disclosure vulnerability</title>
      <reference>http://1337day.com/exploit/20077</reference>
      <type>FPD</type>
    </vulnerability>
    <vulnerability>
      <title>moneymasters File Upload Vulnerability (metasploit)</title>
      <reference>http://1337day.com/exploit/20076</reference>
      <type>UPLOAD</type>
    </vulnerability>
  </theme>

  <theme name="ovum">
    <vulnerability>
      <title>XSS vulnerability in Imediapixel premium WordPress themes</title>
      <reference>http://jannefi.blogspot.fi/2012/10/xss-vulnerability-in-imediapixel.html</reference>
      <type>XSS</type>
    </vulnerability>
  </theme>

  <theme name="avanix">
    <vulnerability>
      <title>XSS vulnerability in Imediapixel premium WordPress themes</title>
      <reference>http://jannefi.blogspot.fi/2012/10/xss-vulnerability-in-imediapixel.html</reference>
      <type>XSS</type>
    </vulnerability>
  </theme>

  <theme name="ebiz">
    <vulnerability>
      <title>XSS vulnerability in Imediapixel premium WordPress themes</title>
      <reference>http://jannefi.blogspot.fi/2012/10/xss-vulnerability-in-imediapixel.html</reference>
      <type>XSS</type>
    </vulnerability>
  </theme>

  <theme name="ecobiz">
    <vulnerability>
      <title>XSS vulnerability in Imediapixel premium WordPress themes</title>
      <reference>http://jannefi.blogspot.fi/2012/10/xss-vulnerability-in-imediapixel.html</reference>
      <type>XSS</type>
    </vulnerability>
  </theme>

  <theme name="traject">
    <vulnerability>
      <title>XSS vulnerability in Parallelus premium WordPress themes</title>
      <reference>http://jannefi.blogspot.fi/2012/10/xss-vulnerability-in-parallelus-premium.html</reference>
      <type>XSS</type>
    </vulnerability>
  </theme>

  <theme name="intersect">
    <vulnerability>
      <title>XSS vulnerability in Parallelus premium WordPress themes</title>
      <reference>http://jannefi.blogspot.fi/2012/10/xss-vulnerability-in-parallelus-premium.html</reference>
      <type>XSS</type>
    </vulnerability>
  </theme>

  <theme name="salutation">
    <vulnerability>
      <title>XSS vulnerability in Parallelus premium WordPress themes</title>
      <reference>http://jannefi.blogspot.fi/2012/10/xss-vulnerability-in-parallelus-premium.html</reference>
      <type>XSS</type>
    </vulnerability>
  </theme>

  <theme name="unite">
    <vulnerability>
      <title>XSS vulnerability in Parallelus premium WordPress themes</title>
      <reference>http://jannefi.blogspot.fi/2012/10/xss-vulnerability-in-parallelus-premium.html</reference>
      <type>XSS</type>
    </vulnerability>
  </theme>

  <theme name="shapeless">
    <vulnerability>
      <title>XSS vulnerability in multiple premium WordPress themes by Flow/Devatic</title>
      <reference>http://jannefi.blogspot.fi/2012/09/xss-vulnerability-in-multiple-premium.html</reference>
      <type>XSS</type>
    </vulnerability>
  </theme>

  <theme name="brisk">
    <vulnerability>
      <title>XSS vulnerability in multiple premium WordPress themes by Flow/Devatic</title>
      <reference>http://jannefi.blogspot.fi/2012/09/xss-vulnerability-in-multiple-premium.html</reference>
      <type>XSS</type>
    </vulnerability>
  </theme>

  <theme name="blaze">
    <vulnerability>
      <title>XSS vulnerability in multiple premium WordPress themes by Flow/Devatic</title>
      <reference>http://jannefi.blogspot.fi/2012/09/xss-vulnerability-in-multiple-premium.html</reference>
      <type>XSS</type>
    </vulnerability>
  </theme>

  <theme name="eunice">
    <vulnerability>
      <title>XSS vulnerability in multiple premium WordPress themes by Flow/Devatic</title>
      <reference>http://jannefi.blogspot.fi/2012/09/xss-vulnerability-in-multiple-premium.html</reference>
      <type>XSS</type>
    </vulnerability>
  </theme>

  <theme name="explicit">
    <vulnerability>
      <title>XSS vulnerability in multiple premium WordPress themes by Flow/Devatic</title>
      <reference>http://jannefi.blogspot.fi/2012/09/xss-vulnerability-in-multiple-premium.html</reference>
      <type>XSS</type>
    </vulnerability>
  </theme>

  <theme name="essence">
    <vulnerability>
      <title>XSS vulnerability in multiple premium WordPress themes by Flow/Devatic</title>
      <reference>http://jannefi.blogspot.fi/2012/09/xss-vulnerability-in-multiple-premium.html</reference>
      <type>XSS</type>
    </vulnerability>
  </theme>

  <theme name="paramount">
    <vulnerability>
      <title>XSS vulnerability in multiple premium WordPress themes by Flow/Devatic</title>
      <reference>http://jannefi.blogspot.fi/2012/09/xss-vulnerability-in-multiple-premium.html</reference>
      <type>XSS</type>
    </vulnerability>
  </theme>

  <theme name="picturefactory">
    <vulnerability>
      <title>XSS vulnerability in multiple premium WordPress themes by Flow/Devatic</title>
      <reference>http://jannefi.blogspot.fi/2012/09/xss-vulnerability-in-multiple-premium.html</reference>
      <type>XSS</type>
    </vulnerability>
  </theme>

  <theme name="sparky">
    <vulnerability>
      <title>XSS vulnerability in multiple premium WordPress themes by Flow/Devatic</title>
      <reference>http://jannefi.blogspot.fi/2012/09/xss-vulnerability-in-multiple-premium.html</reference>
      <type>XSS</type>
    </vulnerability>
  </theme>

  <theme name="theagency">
    <vulnerability>
      <title>XSS vulnerability in multiple premium WordPress themes by Flow/Devatic</title>
      <reference>http://jannefi.blogspot.fi/2012/09/xss-vulnerability-in-multiple-premium.html</reference>
      <type>XSS</type>
    </vulnerability>
  </theme>

  <theme name="konzept">
    <vulnerability>
      <title>XSS vulnerability in multiple premium WordPress themes by Flow/Devatic</title>
      <reference>http://jannefi.blogspot.fi/2012/09/xss-vulnerability-in-multiple-premium.html</reference>
      <type>XSS</type>
    </vulnerability>
  </theme>

  <theme name="daisho">
    <vulnerability>
      <title>XSS vulnerability in multiple premium WordPress themes by Flow/Devatic</title>
      <reference>http://jannefi.blogspot.fi/2012/09/xss-vulnerability-in-multiple-premium.html</reference>
      <type>XSS</type>
    </vulnerability>
  </theme>

  <theme name="wise">
    <vulnerability>
      <title>Site5 Wordpress Themes Email Spoofing</title>
      <reference>http://packetstormsecurity.org/files/114750/</reference>
      <type>UNKNOWN</type>
    </vulnerability>
  </theme>

  <theme name="webfolio">
    <vulnerability>
      <title>Site5 Wordpress Themes Email Spoofing</title>
      <reference>http://packetstormsecurity.org/files/114750/</reference>
      <type>UNKNOWN</type>
    </vulnerability>
  </theme>

  <theme name="colorbold">
    <vulnerability>
      <title>Site5 Wordpress Themes Email Spoofing</title>
      <reference>http://packetstormsecurity.org/files/114750/</reference>
      <type>UNKNOWN</type>
    </vulnerability>
  </theme>

  <theme name="rockwell">
    <vulnerability>
      <title>Site5 Wordpress Themes Email Spoofing</title>
      <reference>http://packetstormsecurity.org/files/114750/</reference>
      <type>UNKNOWN</type>
    </vulnerability>
  </theme>

  <theme name="xmas">
    <vulnerability>
      <title>Site5 Wordpress Themes Email Spoofing</title>
      <reference>http://packetstormsecurity.org/files/114750/</reference>
      <type>UNKNOWN</type>
    </vulnerability>
  </theme>

  <theme name="designpile">
    <vulnerability>
      <title>Site5 Wordpress Themes Email Spoofing</title>
      <reference>http://packetstormsecurity.org/files/114750/</reference>
      <type>UNKNOWN</type>
    </vulnerability>
  </theme>

  <theme name="alltuts">
    <vulnerability>
      <title>Site5 Wordpress Themes Email Spoofing</title>
      <reference>http://packetstormsecurity.org/files/114750/</reference>
      <type>UNKNOWN</type>
    </vulnerability>
  </theme>

  <theme name="boldy">
    <vulnerability>
      <title>Site5 Wordpress Themes Email Spoofing</title>
      <reference>http://packetstormsecurity.org/files/114750/</reference>
      <type>UNKNOWN</type>
    </vulnerability>
  </theme>

  <theme name="simplo">
    <vulnerability>
      <title>Site5 Wordpress Themes Email Spoofing</title>
      <reference>http://packetstormsecurity.org/files/114750/</reference>
      <type>UNKNOWN</type>
    </vulnerability>
  </theme>

  <theme name="diary">
    <vulnerability>
      <title>Site5 Wordpress Themes Email Spoofing</title>
      <reference>http://packetstormsecurity.org/files/114750/</reference>
      <type>UNKNOWN</type>